id,sku,short_description,price,list_price,price_usd,discount,discount_rate,review_count,order_count,inventory_status,is_visible,stock_item_qty,stock_item_max_sale_qty,product_name,brand_id,brand_name
2039747,8122174564682,"Bộ Nồi Inox 3 Đáy Sunhouse SH334 bao gồm 3 nồi với kích thước lần lượt 16cm, 20cm và 24cm đáp ứng tốt nhu cầu sử dụng. Thân nồi được thiết kế thân phẳng, kiểu dáng châu Âu sang trọng.Với chất...",489000,690000,,201000,29,95,,available,,1000,1000,,41048,Sunhouse
25421013,6064688338125,"Bộ Nồi Inox 3 Đáy Sunhouse SH335 chất liệu inox sáng bóng, bền đẹp, sử dụng được trên mọi loại bếp.Quai núm bằng inox, đinh tán chắc chắn, an toàn khi sử dụng.Đáy nồi cấu tạo 3 lớp, truyền nhi...",419000,620000,,201000,32,143,,available,,1000,1000,,41048,Sunhouse
83412126,2186358773080,Bình Giữ Nhiệt Lock&Lock Energetic One-Touch Tumbler LHC3249 - 550ML với thiết kế nắp mở một chạm dễ dàng: Đẩy sang trái để mở khóa đồng thời mở nắp.Miệng cốc rộng: Dễ dàng thêm đá viên và chùi ...,246000,528000,,282000,53,3425,,available,,1000,1000,,48077,LocknLock
99621372,4566919726066,"Bình giữ nhiệt Lock&Lock Belt Bottle LHC4267 490ml với quai xách kiểu dáng dây đai giúp dễ dàng mang đi.Tay cầm TPE ngăn nắp rơi ra và mất, dây đai cố định nắp trong khi uống.Nắp được giữ cố ...",235000,473000,,238000,50,1319,,available,,1000,1000,,48077,LocknLock
71890908,5955369732589,Thùng giặt bằng nhựa chắc chắnBộ lau nhà xoay 360 độ SUNHOUSE KS-CL330S được thiết kế tiện dụng với thùng vắt làm bằng nhựa tổng hợp với 2 màu sắc bắt mắt là xanh lá cây và màu tím. Kích thước phù hợ...,246000,406000,,160000,39,587,,available,,1000,1000,,41048,Sunhouse
200960836,7258950772391," Đóng gói:  1 dây đèn fairy light️ Tính năng Dây đèn trang trí giáng sinh với biểu tượng dễ thương như cây thông, người tuyết, ông già Noel và chim cánh cụt. Bóng đèn kiểu fairy light dịu nhẹ, tiết k...",79000,79000,,0,0,16,,available,,1000,1000,,5706641,NAVIVU
186558014,6994053079370,"Combo 10 Móc Dán Tường Treo Đồ Đa Năng Siêu Chịu LựcMỗi miếng dán sử dụng keo cường lực, độ bám dính tốt, nhưng khách chỉ nên dán trên bề mặt tường mịn màng, không lồi lỗ để đảm bảo thời gian sử dụng...",25000,25000,,0,0,353,,available,,1000,1000,,5706641,NAVIVU
42718737,1453303550991,"- Đèn Led Trang Trí Dài 6M - 40 Bóng Trang Trí Noel Lễ Tết là sản phẩm không thể thiếu khi trang trí các quán cafe, nhà hàng , karaoke, lễ hội , các phòng studio chụp ảnh , gia đình các dịp lễ , tết ,...",80000,80000,,0,0,447,,available,,1000,1000,,111461,OEM
273162903,6916374149264," Đóng gói:  1 hộp châu trang trí Noel (Hộp 24 quả)️ Tính năng Quả châu trang trí với nhiều màu sắc thích hợp để trang trí nhà cửa, treo cây thông giáng sinh. Kèm dây trên mỗi quả. Mỗi hộp có 3 loại q...",70000,70000,,0,0,1,,available,,1000,1000,,5706641,NAVIVU
73124602,7494611465205,Bình Giữ Nhiệt Thép Không Gỉ Vacuum Bottle Lock&Lock LHC6180FU (800ml) thiết kế xách tay dễ dàng cho việc mang theo. Màu sắc nổi bật mang đển cảm giác trẻ trung khi sử dụng.Bình giữ nhiệ...,300000,677000,,377000,56,6853,,available,,1000,1000,,48077,LocknLock
195111061,7956346945610,"Chảo chống dính Inox đáy từ nguyên khối đáy liên Elmich Trimax Classic EL-2702OL có cấu tạo 2 lớp thân đáy liền bắt nhiệt nhanh, tỏa nhiệt đềuThân chảo Trimax classic có cấu tạo 2 lớp dày dặn:Chống...",331000,820000,,489000,60,37,,available,,1000,1000,,31627,Elmich
201592117,6014388926718,"Vớ Nhung Đỏ Thêu Chữ Merry Christmas Trang Trí Cây Thông Noel Giáng Sinh Đóng gói:  1 vớ nhung trang trí kích thước cao 16cm, ngang 12cm.️ Tính năng Vớ nhung đỏ được thêu biểu tượng giáng sinh và ch...",30000,30000,,0,0,16,,available,,1000,1000,,5706641,NAVIVU
579962,1221996228592,"Thân nồi được làm bằng inox cao cấpChất liệu inox cao cấp giúp cho bộ nồi SH781 sáng bóng, bền đẹp. Bạn sẽ yên tâm sử dụng sản phẩm trong thời gian dài mà không phải bận tâm về việc nồi bị han gỉ....",559000,559000,,0,0,0,,available,,1000,1000,,41048,Sunhouse
129143705,1375481910388,"       NỒI HẤP INOX 3 TẦNG 28CM   ĐIỂM NỔI BẬT   - Bộ nồi hấp đa năng gồm:01 nồi đáy, 01 giá hấp, 02 miếng lót khi hấp, 1 nắp.   - Dùng được cho mọi loại bếp: bếp từ, bếp ga, bếp hồng ngoại   ...",99000,99000,,0,0,0,,available,,1000,1000,,111461,OEM
48045630,8111055666089,Panasonic là thương hiệu nổi tiếng thế giới chuyên sản xuất các dòng pin gắn trong. Mang lại hiệu suất tuyệt vời cho thiết bị đồng thời bảo vệ môi trườngVới công nghệ NHẬT BẢN Pin CR2032 sẽ mang lại ...,80000,100000,,20000,20,692,,available,,1000,1000,,18804,Panasonic
99868980,5466758134944,"   Bình Giữ Nhiệt Locknlock Bucket Tumbler LHC4269 có tay cầm chắc chắn thuận tiện mang đi.Nắp và lưới lọc có thể tháo rời, dễ dàng vệ sinh.Miệng bình rộng đủ để vệ sinh bên trong và thêm đá v...",225000,473000,,248000,52,2189,,available,,1000,1000,,48077,LocknLock
134360863,2656755417428,"       QUY CÁCH ĐÓNG GÓI : Vỉ 6 Viên Pin   kích thước : AA là pin to hay lắp đồng hồ , chuột không dây , khoá từ , đồ chơi trẻ em    - AAA là pin nhỏ , hay lắp vào remote điều hoà , Máy đo huyết...",77000,90000,,13000,14,95,,available,,1000,1000,,19312,Energizer
54484578,3821461114290,"MÔ TẢ SẢN PHẨM*LƯU Ý !!!: Sản phẩm có 03 phiên bản: Đèn không tích điện: cần phải cắm vào nguồn điện như: ổ điện, máy tính, sạc dự phòng mới có thể sử dụng đượcĐèn tích điện: tích hợp pin lithium...",179000,199000,,20000,10,2086,,available,,1000,1000,,835483,eLights
259514009,5343195603292,"GIÁ SỈ SIÊU LỢI:Giá chỉ còn 800đ Số lượng: 500 cáiGiá chỉ còn 1.000đ Số lượng: 300 cái Muỗng Đong Định Lượng Greenhome, 2 Đầu, Chia Vạch Sẵn, Tiện Lợi, Đong Phân Bón Dạng Bột, Gia Vị  ...",1800,3000,,1200,40,0,,available,,1000,1000,,154455,Greenhome
42465518,2172276129698,#cây thông noel #cay thong noel #cây thông nô en #cay thong no en #cây thông giáng sinh #cay thong giang sinh #ông già noel #ong gia noel #ông già nô en #ong gia no en #trang trí cây thông noel #ông g...,231000,299000,,68000,23,162,,available,,1000,1000,,111461,OEM
195852183,6345258326968,Bình giữ nhiệt bằng thép không gỉ LocknLock Jumbo Tumbler LHC4300 có:Dung tích bình lơn (900 ml) Quai xách chống trượt Miệng bình rộng dễ dàng cho đá vào và dễ dàng chùi rửa Có khay lọc ngăn đá ho...,365000,730000,,365000,50,226,,available,,1000,1000,,48077,LocknLock
262362970,2681401040591,DUNG TÍCH CỐC LỚN ĐỦ ĐỂ CUNG CẤP LƯỢNG NƯỚC HÀNG NGÀYCa giữ nhiệt Flat Table Mug LocknLock LHC4320 để bàn dung tích 730ml giúp bạn duy trì lượng nước cho cơ thểTAY CẦM THOẢI MÁITay cầm nặng giúp b...,256000,540000,,284000,53,77,,available,,1000,1000,,48077,LocknLock
53583472,4451468802389,"Bộ Hộp Cơm Giữ Nhiệt Lock&Lock Easy Carry 2L LHC8039 Có Túi (1 Hộp 720ml, 2 Hộp 420ml Kèm 1 Bộ Muỗng Và Nĩa) được làm bằng chất liệu thép không gỉ cao cấp, không những bền chắc mà còn mang lại hi...",800000,1667000,,867000,52,2612,,available,,1000,1000,,48077,LocknLock
52760599,1154831578678,"Dây đèn LED đom đóm với nhiều bóng nhỏ nối tiếp với khả năng chống nước IP44 để có thể trang trí ngoài trời vào dịp lễ, Tết, giáng sinh.Có nhiều độ dài khác nhau để sử dụng tùy theo mục đích.Sử dụng n...",79000,79000,,0,0,243,,available,,1000,1000,,111461,OEM
174236741,8584642860617,Găng tay cao su tự nhiên Lock&Lock ETM83có móc treo tiện lợi có thể móc lên sau khi sử dụng hoặc giặt rửa.Chất liệu 100% cao su tự nhiên không chứa BPA độc hại.Bảo vệ da và móng giúp tay bạn tr...,27000,56000,,29000,52,117,,available,,1000,1000,,48077,LocknLock
17593518,7271078876801,"Bộ Hộp Cơm Giữ Nhiệt Thép Không Gỉ Lock & Lock LHC8031SLV-OCH - Bạc Gồm 3 hộp: 1 Hộp cơm 460ml, 1 hộp thức ăn 420ml và 1 hộp 280ml, 1 túi đựng, 1 đôi đũaThiết kế sang trọng, đường né...",617000,1285000,,668000,52,925,,available,,1000,1000,,48077,LocknLock
226036798,9070987023180,"Bình Giữ Nhiệt LocknLock 550ml LHC3249 với phần nắp bật dễ dàng mở và thưởng thức đồ uốngHọa tiết hoa anh đào mới lạ, trẻ trungChất liệu bình bằng thép không gỉ 316L giúp sản phẩm chịu nhiệt và chố...",269000,549000,,280000,51,91,,available,,1000,1000,,48077,LocknLock
3480627,9330774535233,"  Bộ Cây Lau Nhà Xoay Tay Compact Spin Mop Lock&Lock ETM466: Thùng Giặt + Cây + Bông LauThùng chứa được làm bằng chất liệu nhựa PP cao cấp, chất lượng, có khả năng chịu được va đập tốt, cho độ...",436000,924000,,488000,53,1283,,available,,1000,1000,,48077,LocknLock
892121,8567702194984,"Pin Max 8 + 4 Viên Energizer E91 BP8+4 AA là sản phẩm có thể sử dụng cho các loại máy ảnh, điều khiển từ xa, đèn Pin, máy chơi game không dây, máy nghe nhạc MP3 và các thiết bị kỹ thuật số cá nhân kh...",129000,129000,,0,0,394,,available,,1000,1000,,19312,Energizer
203757099,4278396651296,MÔ TẢ SẢN PHẨM Ổ Cắm Điện Du Lịch Quốc Tế Đa Năng Tamayoko - Trợ thủ không thể thiếu của bạnTích hợp 3 cổng USB-A và 1 cổng USB type C công suất 15W cho phép sạc nhanh nhiều thiết bị cùng lúcC...,475000,500000,,25000,5,44,,available,,1000,1000,,4244853,Tamayoko
182971940,7966240754631,Bình giữ nhiệt LocknLock có 2 nắp thay thế New Clip Tumbler 540ml LHC4279 có cấu trúc tường đôi cho hiệu quả cách nhiệt và giữ mát xuất sắc cũng như ngăn ngừa được việc đọng nước ngoài thành bình.Ha...,242000,520000,,278000,53,308,,available,,1000,1000,,48077,LocknLock
84566545,3448170956202,Ổ cắm đa năng USB Nakagami công nghệ Nhật Bản. Sản phẩm ổ cắm điện Nakagami có thiết kế kiểu dáng nhỏ gọn có thể sử dụng đa năng cho nhiều vị trí trong gia đình bạn. Thiết kế bao gồm 2 lỗ cắm USB và ...,151050,155000,,3950,3,1003,,available,,1000,1000,,290071,Nakagami
76451291,3971953833717,"Dây đèn LED mini dễ dàng uốn cong để bạn trang trí tiệc hay quấn quanh các vật dụng trong nhà.Nguồn: sử dụng pin nút áo CR2032 (kèm theo sẵn), mở là sáng.Dây 1m có 10 bóng led, dây 2m có 20 bóng, dây ...",20000,20000,,0,0,104,,available,,1000,1000,,111461,OEM
52581646,8663471847547,"Dây đèn LED rèm với hình sao lớn nhỏ kèm tính năng chống thấm nước giúp trang trí ngoài trời cho những dịp lễ, Tết, tiệc, giáng Thông số:Chống nước IP44.Có công tắc điều chỉnh chế độ chớp đèn.Ngôi sao...",120000,120000,,0,0,247,,available,,1000,1000,,111461,OEM
206242343,4574220257261," Đóng gói:  1 hộp nến thơm 4.2x6.3cm với mùi tùy chọn (hoa văn hộp là ngẫu nhiên)️ Tính năng Nến thơm làm từ sáp đậu nành, thân thiện môi trường, không nói, không độc hại. Mùi thơm tự nhiên dễ chịu g...",45000,45000,,0,0,15,,available,,1000,1000,,5706641,NAVIVU
189208326,6461901702576,"Thảm nhà tắm, nhà bếp siêu thấm nước, chống trơn trượt tối giản, hiện đại NAVIVUƯu điểm sản phẩm:Thấm hút nhanh trong thời gian tíc tắcThảm có lớp bám sàn, chống trơn trượt rất tốt, an toàn cho ngư...",99000,99000,,0,0,61,,available,,1000,1000,,5706641,NAVIVU
125739804,6232673402599,"TÍNH NĂNG của BỘ CÂY LAU NHÀ THÔNG MINH SAGOKER:Tất cả trong một cây lau nhà tiết kiệm nước và sạch sẽ.Rửa cả hai bên, cộng thêm có khả năng thay thế bông lau, làm sạch mà không cần dùng sức nhiều....",151999,159999,,8000,5,147,,available,,1000,1000,,4024633,SAGOKER
32178097,2080349748762,"Chảo Kim Cương Đáy Từ Nagakawa NAG2653 Lòng chảo: Sâu lòngCán chảo: Nhựa Bakelit chịu nhiệtĐáy từ: CóSản phẩm được thiết kế từ nhôm cao cấp an toànĐáy từ độ bền cao, bắt từ đềuChống dính đa lớp ...",333000,585000,,252000,43,811,,available,,1000,1000,,110935,Nagakawa
53789448,6888275518789,   BẠN MUỐN MUA THÊM SẢN PHẨM KHÁC CỦA PARROTI Bộ lau nhà ProMax - Size LớnThùng rác Parroti BinCọ bồn cầu Parroti Silicon Bộ cây lau nhà thông minh tự vắt Parr...,395000,799000,,404000,51,3766,,available,,1000,1000,,746615,Parroti
55124901,7471618232146,"Thùng rác mini có thể sử dụng ở nhiều nơi khác nhau như trong phòng ngủ, trong toilet, hoặc trong xe hơi, rất tiện dụng và vệ sinh.Chất liệu nhựa ABS và PP với nắp kín giúp giữ mùi bên trong thùng khô...",87700,97400,,9700,10,3,,available,,1000,1000,,111461,OEM
269846183,3435398818440,"Bộ cây lau nhà thông minh tự vắt DAMAS G130 với khả năng lau sạch sàn nhà một cách nhanh chóng và nhẹ nhàng, phù hợp với mọi loại bề mặt sàn như sàn gạch, sàn gỗ, sàn đá, tường ốp gạch và mặt kính, p...",279000,500000,,221000,44,11,,available,,1000,1000,,4234729,Damas
1399571,5944614557985,"Gối Memory Foam 50D Hình Cong Lock&Lock HLW111 là chiếc gối với thiết kế định hình lượn sóng, theo khung của đầu và gáy, giúp điều chỉnh sự gấp khúc của đường thở trong khi ngủ, mang đến cho bạn ...",289000,289000,,0,0,0,,available,,1000,1000,,48077,LocknLock
467912,1273756821437,"Thiết kế nhỏ gọn, thích hợp với mọi không gianMáy khoan động lực Bosch GSB 550 550W sở hữu thiết kế nhỏ gọn với khối lượng chỉ 1.8 kg, giúp người dùng thoải mái khi sử dụng thích hợp bố trí ở những k...",1399000,2177000,,778000,36,1014,,available,,1000,1000,,25229,Bosch
11058658,3505486111914,Túi đựng rác tự phân hủy được sản xuất bởi chất liệu HDPE và Phụ gia tự hủyTúi có khả năng tự phân hủy trong môi trường tự nhiên trong thời gian ít hơn rất nhiều so với các loại túi rác thông thường ...,40000,54000,,14000,26,606,,available,,1000,1000,,288231,Titapha
197867507,1815107473925,"Cây Lau Nhà Tự Vắt Thông Minh Đa Năng VinBuy Chất Liệu Cao Cấp Tặng Kèm 2 Miếng Lau Chổi lau nhà vắt khô nước đến 90-95%, vắt nước nhẹ nhàng khi có con lăn trợ lực kéo lên kéo xuống là vắt khô nước....",172000,299000,,127000,42,19,,available,,1000,1000,,4224691,VinBuy
17423771,1693054414764,Hàng năm có khoảng 600 triệu viên pin bị vứt bỏ. Số lượng pin này xếp dài ra sẽ tương đương quãng đường từ Anh sang Úc!Pin có nhiều loại với nhiều kích thước khác nhau: Có viên pin có kích thước chỉ n...,75000,100000,,25000,25,663,,available,,1000,1000,,18804,Panasonic
217478473,7191727332178,"Ổ Cắm Điện Comet 4 Lỗ 3 Chấu, 3 Lỗ 2 Chấu CES4433 được thiết kế khoa học, an toàn tối đa cho người sử dụng. Thiết bị có kích thước nhỏ cùng chiều dài dây điện 3 mét giúp bạn có thể di chuyển cũng như ...",122000,209000,,87000,42,29,,available,,1000,1000,,19588,Comet
67561868,3899460705818,"vỉ 10 Pin cúc áo pin điện tử đồng hồ LR44 AG13 LR41 AG3 CR2032 loại tốt bềnPin cúc áo được sử dụng phổ biến trong các thiết bị điện tử gia dụng như đồng hồ điện tử, máy tính bỏ túi, làm nguồn cung ...",29000,29000,,0,0,8,,available,,1000,1000,,111461,OEM
118433132,8777495355123,"       THÔNG TIN SẢN PHẨM:   ️ Cân nặng: 1,2 kg   ️ Độ sâu: 11cm   - Các món ăn như đậu chiên, cá phi lê khi vỏ ngoài giòn, ruột mềm   ️ Chảo được tráng lớp mặt đá ceramic nên đun, xào không l...",107900,107900,,0,0,3,,available,,1000,1000,,111461,OEM
262783371,5098601878758,"Túi đựng bình nước  có thể mang nhiều loại bình nước, ly giữ nhiệt khác nhau.Bề mặt túi trong suốt, có thể thấy được đồ vật bên trong.Miệng túi có nút gài, giúp bình nước không bị rơi ra khi treo.Kíc...",19000,20000,,1000,5,10,,available,,1000,1000,,839837,FuNu
176598081,9413822411143,Bình giữ nhiệt LocknLock Metro Two Way 475ml đi kèm với một nắp thuận tiện để uống trong văn phòng và một nắp to-go kín hơi dễ dàng mang đi.Bạn có thể tháo rời nắp giữa để bình trở nên gọn nhẹ hơn....,293000,605000,,312000,52,267,,available,,1000,1000,,48077,LocknLock
36960736,5175629381696,"Kích thước: 3m, 6m, 10mNguồn: Loại 3m và 6m dùng 2 pin tiểu 3A; loại 10m dùng điện và có đầu chờ để nối tiếp nhiều bộ với nhauChất liệu: Nhựa, LEDThông số chống nước, chống bụi: IP55Màu sắc: Vàng,...",44999,44999,,0,0,106,,available,,1000,1000,,111461,OEM
205894449,5838665511041,"MẪU 1: MÓC THÉP DÁN TƯỜNG- Miếng dán chỉ dính chặt trên bề mặt láng phẳng: gạch men, kính, bề mặt tủ lạnh..., không dán trên tường sơn- Lau tường nơi bạn cần dán thật sạch, khô.- Dán và lấy tay chà m...",13800,15000,,1200,8,2,,available,,1000,1000,,839837,FuNu
41227454,2121706017043,"Combo 30 móc treo đồ siêu bền, không gãy loại lớn Prota thích hợp cho bạn treo các loại quần áo, chịu được sức nặng mà không lo bị gãy, vỡ sản phẩm.Móc có thể sử dụng treo đồ lót, quần áo, khăn tắm,...",55000,75000,,20000,27,23,,available,,1000,1000,,40699,Prota
127031393,9115457631995,  Ca nước giữ nhiệt LocknLock Metro Mug LHC4219 với lớp sơn tĩnh điện bền chắc và chất liệu thép không gỉ hợp vệ sinhDễ dàng mở với nắp xoay Swing capDễ chùi rửa với miệng ca rộngGiữ ca cố định...,299000,506000,,207000,41,53,,available,,1000,1000,,48077,LocknLock
57867023,3339191897104,"Cây lau nhà xoay 360 độ SUNHOUSE KS-MO350I có cán làm bằng inox 201 với tay cầm bằng nhựa PP cao cấp, chắc chắn, không bị han gỉ và có thể tháo lắp dễ dàng khi sử dụng. Cây lau có thể điều chỉnh độ dà...",130000,200000,,70000,35,605,,available,,1000,1000,,41048,Sunhouse
580040,1228374919714,"Chảo Đá Chống Dính Siêu Bền Sunhouse SBD24 24cm với chất liệu hợp kim nhôm dày 3mm phủ lớp chống chính an toàn và siêu bền, không dễ bong tróc lớp chống dính trên bề mặt như những loại chảo khác và đặ...",208000,320000,,112000,35,51,,available,,1000,1000,,41048,Sunhouse
892141,9969906367307,"Pin Max 8 + 4 Viên Energizer E92 BP8+4 AAAENERGIZER là thương hiệu của Mỹ, nhà sản xuất pin lâu năm và uy tín trên thế giới trong nhiều năm qua.Thông tin sản phẩm:- Điện áp: 1.5V- Kích cỡ: pin AAA,...",119000,119000,,0,0,259,,available,,1000,1000,,19312,Energizer
58852893,2590771621057,"Bình giữ nhiệt Lock&Lock Metro Double LHC4202 dễ dàng mang đi với dây treo: bình giữ nhiệt nhẹ, quai xách để thuận tiện mang đi.Bộ lọc silicone có thể tháo rời giúp giữ đá không bị chảy ra khi r...",296000,605000,,309000,51,782,,available,,1000,1000,,48077,LocknLock
2119173,3784672643501,"Đặc điểm nổi bậtCây Lau Nhà Dạng Xịt Nước Lock&Lock ETM472 thiết kế cây lau nhà dạn đứng với thiết kế tay cầm có cần gạt để điểu khiển việc phun nước, giúp dễ thao tác, tạo cảm giác thoải mái kh...",259000,539000,,280000,52,1056,,available,,1000,1000,,48077,LocknLock
52626416,9005942072406,"Chiếu điều hòa cao su nonKết cấu sợi vải bền chắc, dẻo dai. Kiểm soát nhiệt độ tốtThiết kế hiện đại họa tiết sang trọng , phù hợp với mọi lứa tuổiSản phẩm dùng được quanh năm, thay thế ga chiếu vô ...",390000,390000,,0,0,0,,available,,1000,1000,,111461,OEM
84886093,6456848067230,Đặc điểm nổi bậtVợt muỗi thông minh 3in1 Sunhouse SHE-PRO11.W tích hợp 3 chức năng: vợt muỗi + dèn diệt muỗi + đèn ngủ.Vợt có kiểu dáng gọn nhẹ với màu trắng sang trọng tạo nên chiếc vợt vừa hiện đ...,201000,344000,,143000,42,150,,available,,1000,1000,,41048,Sunhouse
186862075,8600700427795,Xin lưu ý về sản phẩm:Hiện sản phẩm Nắp ngăn mùi Ecodeals có 5 kích cỡ (đa dạng nhất trên thị trường hiện nay):- Size A: Lỗ sàn 33-39mm (đi kèm bộ vòng đệm slicone rời)- Size B: Lỗ sàn 40-50mm (đi ...,28000,29000,,1000,3,51,,available,,1000,1000,,7367633,Eco deals
198069246,4706257345212,"Bộ cây lau nhà VinBuy kèm thùng tự vắt thông minh, chổi lau nhà xoay 360 độ lau sạch nhanh...",279000,511000,,232000,45,20,,available,,1000,1000,,4224691,VinBuy
77775165,7514367100786,"Hộp Bảo Quản Thủy Tinh Locknlock Top Class có khả năng đóng kín tuyệt đối ngăn chặn không khí bên ngoài và bên trong nhờ ""khóa 4 cạnh"".Nắp được làm từ ""chất liệu tritan"" nên có thể sử dụng lâu dà...",69000,159000,,90000,57,914,,available,,1000,1000,,48077,LocknLock
58804363,7785294673323,"Lực băm nghiền mạnh nhờ hoạt động bằng phương pháp xoay và ba lưỡi dao bằng thép không gỉ.Nếu bạn kéo thanh kéo nhiều lần, ba lưỡi dao sẽ quay nhanh và băm đều rau củ.Lưỡi dao bằng thép không gỉ k...",78000,171000,,93000,54,2811,,available,,1000,1000,,48077,LocknLock
203569872,6789176999609,"Khăn tắm hình thú 70x140cm này đẹp mê hồn luôn ạ mềm, thấm nước, nhanh khô.Khăn có thể dùng quấn cho các bé vì độ mềm mịn của khăn là rất tốt.Ưu điểm nổi trội của ẻm này là khổ rất rộng các bạn có t...",36000,38000,,2000,5,15,,available,,1000,1000,,839837,FuNu
117353723,8574020376721,"Chiếu ngủ văn phòng cao cấp Chất liệu nhựa 2 lớp: lớp mút và lớp bạc êm ái Gọn nhẹ, dễ dàng mang theo khi đi dã ngoại, văn phòng Xếp gọn và vệ sinh dễ dàng Cho giấc ngủ trưa ngon, không nóng bức  ...",40000,40000,,0,0,318,,available,,1000,1000,,293033,Krishna
56400156,9088178996234,"Dây đèn LED hình ngôi sao kích thước 4cm giúp bạn trang trí phòng khách, phòng ngủ thêm sang trọng.Dây đèn LED rất dễ dàng lắp đặt và sử dụng.Có 3 loại nguồn điện để chọn: Pin, USB hoặc cắm điện.Độ bề...",43000,43000,,0,0,180,,available,,1000,1000,,111461,OEM
47115292,1322089791471,"Đóng gói: 1 dây đèn led (không kèm pin, không kèm remote).Thông tin chi tiết:Tình trạng: sản phẩm mới 100%Nguồn đèn: LEDSản phẩm có thể sử dụng trong nhà hoặc ngoài trờiỨng dụng: đa năng, dùng kh...",20000,20000,,0,0,190,,available,,1000,1000,,111461,OEM
21712076,6879745229342,"Một không gian ấm cúng, lung linh cho gia đình vào những ngày lễ, buổi tiệc không còn khó đối với bạn nữa với dây đèn LED siêu sáng GV-UCSLvới khả năng uốn dẻo cực tốt, giúp trang trí và chiếu s...",53000,53000,,0,0,135,,available,,1000,1000,,230971,GIVASOLAR
201040328,4080016476690,- Bình giữ nhiệt LocknLock Riga Tumbler Vietnam Edition LHC4160 897ml có quai xách dễ dàng mang đi mọi nơi- Bộ lọc thép không gỉ và ngăn đá tràn khi uống- Miệng bình rộng dễ dàng vệ sinh- Ống hút ...,344000,715000,,371000,52,278,,available,,1000,1000,,48077,LocknLock
115092053,6156159064709,"Theo các chuyên gia y tế, tối thiểu bạn nên thay ga giường, gối 1 lần/tuần. Bởi trên mặt ga giường, vỏ gối chứa vô số vi khuẩn từ tế bào chết trên da (cơ thể mất hàng triệu tế bào da mỗi ngày), phấn t...",78000,120000,,42000,35,680,,available,,1000,1000,,697923,LIDACO
46202190,3178844847277,"Túi lưới giặt đồ cho máy giặt bảo vệ quần áo chống biến dạng chất lượng tốt dây kéo lưới mịn Polyester nhằm bảo vệ quần áo được làm từ tơ lụa, ren, len, thổ cẩm, lông thú, gấm, cotton, … tránh bị móc ...",58800,58800,,0,0,360,,available,,1000,1000,,111461,OEM
71924330,8126161754070,"Đặc điểm nổi bậtBộ Chổi Quét Nhà Gồm 1 Cây Chổi + 1 Dụng Cụ Hốt Lock&Lock ETM465 là sản phẩm vô cùng tiện ích, thay thế cho cây chổi quét bình thường thân inox nhỏ , nhẹ dễ luồn lách nhẹ nhàng đ...",214000,428000,,214000,50,355,,available,,1000,1000,,48077,LocknLock
